{
  "$schema": "https://werlen-nevio.github.io/LogicTrail/schema/graph-v1.schema.json",
  "schemaVersion": 1,
  "query": "how does login work?",
  "request": {
    "question": "how does login work?",
    "maxDepth": 12,
    "maxNodes": 60
  },
  "title": "How does login work?",
  "entryPoints": [
    "client/src/pages/LoginPage.tsx#LoginPage"
  ],
  "nodes": [
    {
      "id": "client/src/pages/LoginPage.tsx#LoginPage",
      "type": "component",
      "label": "LoginPage",
      "file": "client/src/pages/LoginPage.tsx",
      "line": 5,
      "description": "React component rendered for /login.",
      "descriptionSource": "static",
      "evidence": [
        {
          "file": "client/src/pages/LoginPage.tsx",
          "line": 5,
          "kind": "definition",
          "text": "export function LoginPage() {"
        }
      ],
      "snippet": {
        "startLine": 5,
        "lines": [
          "export function LoginPage() {",
          "  const navigate = useNavigate();",
          "",
          "  return (",
          "    <AuthLayout title=\"Sign in to Acme\">",
          "      <LoginForm onSuccess={() => navigate(\"/dashboard\")} />",
          "    </AuthLayout>",
          "  );",
          "}"
        ],
        "truncated": false
      },
      "metadata": {
        "symbolKind": "component",
        "qualifiedName": "LoginPage",
        "signature": "export function LoginPage()",
        "async": false,
        "pages": [
          "/login"
        ],
        "kind": "symbol"
      }
    },
    {
      "id": "client/src/components/LoginForm.tsx#LoginForm",
      "type": "component",
      "label": "LoginForm",
      "file": "client/src/components/LoginForm.tsx",
      "line": 8,
      "description": "React component.",
      "descriptionSource": "static",
      "evidence": [
        {
          "file": "client/src/components/LoginForm.tsx",
          "line": 8,
          "kind": "definition",
          "text": "export function LoginForm({ onSuccess }: LoginFormProps) {"
        }
      ],
      "snippet": {
        "startLine": 8,
        "lines": [
          "export function LoginForm({ onSuccess }: LoginFormProps) {",
          "  const [email, setEmail] = useState(\"\");",
          "  const [password, setPassword] = useState(\"\");",
          "  const [error, setError] = useState<string | null>(null);",
          "",
          "  async function handleSubmit(event: FormEvent) {",
          "    event.preventDefault();",
          "    setError(null);",
          "    try {",
          "      const user = await login(email, password);",
          "      onSuccess(user);",
          "    } catch (err) {",
          "      setError((err as Error).message);",
          "    }",
          "  }",
          "",
          "  return (",
          "    <form onSubmit={handleSubmit}>",
          "      <input value={email} onChange={(e) => setEmail(e.target.value)} placeholder=\"Email\" />",
          "      <input",
          "        type=\"password\"",
          "        value={password}",
          "        onChange={(e) => setPassword(e.target.value)}",
          "        placeholder=\"Password\"",
          "      />",
          "      {error && <p role=\"alert\">{error}</p>}",
          "      <button type=\"submit\">Sign in</button>",
          "    </form>",
          "  );",
          "}"
        ],
        "truncated": false
      },
      "metadata": {
        "symbolKind": "component",
        "qualifiedName": "LoginForm",
        "signature": "export function LoginForm({ onSuccess }: LoginFormProps)",
        "async": false,
        "kind": "symbol"
      }
    },
    {
      "id": "nav:/dashboard",
      "type": "route",
      "label": "navigate /dashboard",
      "description": "Client-side navigation to /dashboard.",
      "descriptionSource": "static",
      "evidence": [
        {
          "file": "client/src/pages/LoginPage.tsx",
          "line": 10,
          "kind": "call",
          "text": "<LoginForm onSuccess={() => navigate(\"/dashboard\")} />"
        }
      ],
      "metadata": {
        "navigation": true,
        "path": "/dashboard",
        "framework": "react-router",
        "kind": "navigation"
      },
      "file": "client/src/pages/LoginPage.tsx",
      "line": 10,
      "snippet": {
        "startLine": 9,
        "lines": [
          "    <AuthLayout title=\"Sign in to Acme\">",
          "      <LoginForm onSuccess={() => navigate(\"/dashboard\")} />",
          "    </AuthLayout>"
        ],
        "truncated": false
      }
    },
    {
      "id": "client/src/components/LoginForm.tsx#LoginForm.handleSubmit",
      "type": "function",
      "label": "handleSubmit()",
      "file": "client/src/components/LoginForm.tsx",
      "line": 13,
      "description": "async function handleSubmit(event: FormEvent)",
      "descriptionSource": "static",
      "evidence": [
        {
          "file": "client/src/components/LoginForm.tsx",
          "line": 13,
          "kind": "definition",
          "text": "async function handleSubmit(event: FormEvent) {"
        }
      ],
      "snippet": {
        "startLine": 13,
        "lines": [
          "  async function handleSubmit(event: FormEvent) {",
          "    event.preventDefault();",
          "    setError(null);",
          "    try {",
          "      const user = await login(email, password);",
          "      onSuccess(user);",
          "    } catch (err) {",
          "      setError((err as Error).message);",
          "    }",
          "  }"
        ],
        "truncated": false
      },
      "metadata": {
        "symbolKind": "function",
        "qualifiedName": "LoginForm.handleSubmit",
        "signature": "async function handleSubmit(event: FormEvent)",
        "async": true,
        "parent": "LoginForm",
        "kind": "symbol"
      }
    },
    {
      "id": "client/src/api/auth.ts#login",
      "type": "function",
      "label": "login()",
      "file": "client/src/api/auth.ts",
      "line": 7,
      "description": "Sends the credentials to the API; the server answers with a session cookie.",
      "descriptionSource": "doc",
      "evidence": [
        {
          "file": "client/src/api/auth.ts",
          "line": 7,
          "kind": "definition",
          "text": "export async function login(email: string, password: string): Promise<SignedInUser> {"
        }
      ],
      "snippet": {
        "startLine": 7,
        "lines": [
          "export async function login(email: string, password: string): Promise<SignedInUser> {",
          "  const response = await fetch(\"/api/auth/login\", {",
          "    method: \"POST\",",
          "    headers: { \"Content-Type\": \"application/json\" },",
          "    credentials: \"include\",",
          "    body: JSON.stringify({ email, password }),",
          "  });",
          "  if (!response.ok) {",
          "    throw new Error(\"Invalid email or password\");",
          "  }",
          "  const body = await response.json();",
          "  return body.user;",
          "}"
        ],
        "truncated": false
      },
      "metadata": {
        "symbolKind": "function",
        "qualifiedName": "login",
        "signature": "export async function login(email: string, password: string): Promise<SignedInUser>",
        "async": true,
        "kind": "symbol"
      }
    },
    {
      "id": "route:POST /api/auth/login",
      "type": "route",
      "label": "POST /api/auth/login",
      "file": "server/src/routes/auth.ts",
      "line": 10,
      "description": "express route POST /api/auth/login.",
      "descriptionSource": "static",
      "evidence": [
        {
          "file": "server/src/routes/auth.ts",
          "line": 10,
          "kind": "route",
          "text": "router.post(\"/login\", loginRateLimit, validateBody(loginSchema), authController.login);"
        }
      ],
      "snippet": {
        "startLine": 9,
        "lines": [
          "",
          "router.post(\"/login\", loginRateLimit, validateBody(loginSchema), authController.login);",
          "router.post(\"/logout\", requireAuth, authController.logout);",
          "router.get(\"/me\", requireAuth, authController.me);",
          ""
        ],
        "truncated": false
      },
      "metadata": {
        "method": "POST",
        "path": "/api/auth/login",
        "framework": "express",
        "kind": "route"
      }
    },
    {
      "id": "cond:client/src/api/auth.ts#login:14",
      "type": "condition",
      "label": "!response.ok",
      "file": "client/src/api/auth.ts",
      "line": 14,
      "description": "login() branches on `!response.ok`.",
      "descriptionSource": "static",
      "evidence": [
        {
          "file": "client/src/api/auth.ts",
          "line": 14,
          "kind": "branch",
          "text": "if (!response.ok) {"
        }
      ],
      "snippet": {
        "startLine": 14,
        "lines": [
          "  if (!response.ok) {",
          "    throw new Error(\"Invalid email or password\");",
          "  }",
          "  const body = await response.json();"
        ],
        "truncated": false
      },
      "metadata": {
        "kind": "branch",
        "owner": "client/src/api/auth.ts#login",
        "test": "!response.ok"
      }
    },
    {
      "id": "server/src/middleware/rateLimit.ts#loginRateLimit",
      "type": "function",
      "label": "loginRateLimit()",
      "file": "server/src/middleware/rateLimit.ts",
      "line": 8,
      "description": "Allows at most five login attempts per IP and minute.",
      "descriptionSource": "doc",
      "evidence": [
        {
          "file": "server/src/middleware/rateLimit.ts",
          "line": 8,
          "kind": "definition",
          "text": "export async function loginRateLimit(req: Request, res: Response, next: NextFunction) {"
        }
      ],
      "snippet": {
        "startLine": 8,
        "lines": [